{
  "ticker": "SBER",
  "timeframe": "1H",
  "as_of": "2026-05-15T15:00:00+03:00",
  "combined_probabilities": {
    "buy": 0.375,
    "hold": 0.35,
    "sell": 0.275
  },
  "raw_decision": "BUY",
  "expected_edge": 0.0015,
  "confidence": 0.58,
  "components": {
    "ml_weight": 0.75,
    "llm_weight": 0.25
  }
}
